{
  "category": "patterns",
  "confidence": 0.7,
  "details": "=== CONSENSUS FINDINGS ===\n(No findings reported.)\n=== END CONSENSUS FINDINGS ===\n\n=== CONSENSUS TASK GAPS ===\n(No task gaps reported.)\n=== END CONSENSUS TASK GAPS ===\n\n=== FINDINGS FROM deepseek_deepseek-v4-pro ===\n(No findings reported.)\n=== END FINDINGS FROM deepseek_deepseek-v4-pro ===\n\n=== FINDINGS FROM minimax_minimax-m3 ===\n(No findings reported.)\n=== END FINDINGS FROM minimax_minimax-m3 ===\n\n=== FINDINGS FROM z-ai_glm-5_2 ===\n(No findings reported.)\n=== END FINDINGS FROM z-ai_glm-5_2 ===",
  "fingerprint": "b2df346737bc6316da4f5dace69ca96bc3cfe5e0f029aec4766f8b5cf2ff1cd8",
  "lineage": {
    "issue_number": null,
    "parent_ids": [],
    "pr_number": null,
    "run_id": "36426884508",
    "superseded_by": null,
    "supersedes": null
  },
  "provenance": {
    "actor": "shubhodeep1",
    "run_attempt": 1,
    "run_id": "36426884508",
    "source_refs": [
      "reviewer_consensus.txt"
    ],
    "workflow": "review_autofix"
  },
  "record_id": "mem_20260928133439_ef210a3b43",
  "schema_version": "memory_record.v1",
  "scope": {
    "issue_number": null,
    "level": "run",
    "pr_number": null,
    "run_id": "36426884508"
  },
  "sensitive": false,
  "status": "candidate",
  "summary": "Reviewer consensus produced 0 consensus item(s); none flagged by multiple reviewers",
  "timestamps": {
    "created_at": "2026-09-28T13:34:39Z",
    "promoted_at": null,
    "superseded_at": null
  }
}
