{
  "category": "patterns",
  "confidence": 0.7,
  "details": "=== CONSENSUS FINDINGS ===\n(No findings reported.)\n=== END CONSENSUS FINDINGS ===\n\n=== CONSENSUS TASK GAPS ===\n(No task gaps reported.)\n=== END CONSENSUS TASK GAPS ===\n\n=== FINDINGS FROM deepseek_deepseek-v4-pro ===\n(No findings reported.)\n=== END FINDINGS FROM deepseek_deepseek-v4-pro ===\n\n=== FINDINGS FROM google_gemini-3_1-flash-lite ===\n(No findings reported.)\n=== END FINDINGS FROM google_gemini-3_1-flash-lite ===\n\n=== FINDINGS FROM minimax_minimax-m3 ===\n(No findings reported.)\n=== END FINDINGS FROM minimax_minimax-m3 ===\n\n=== FINDINGS FROM qwen_qwen3_7-plus ===\n(No findings reported.)\n=== END FINDINGS FROM qwen_qwen3_7-plus ===\n\n=== FINDINGS FROM x-ai_grok-4_20 ===\n(No findings reported.)\n=== END FINDINGS FROM x-ai_grok-4_20 ===\n\n=== FINDINGS FROM z-ai_glm-5_2 ===\n(No findings reported.)\n=== END FINDINGS FROM z-ai_glm-5_2 ===",
  "fingerprint": "29e5ce3f8f4f8eb62bd609fe2f641356c7c182f004fc4e041894e7b3d552d420",
  "lineage": {
    "issue_number": null,
    "parent_ids": [],
    "pr_number": 4943,
    "run_id": "36662314734",
    "superseded_by": null,
    "supersedes": null
  },
  "provenance": {
    "actor": "shubhodeep1",
    "run_attempt": 1,
    "run_id": "36662314734",
    "source_refs": [
      "reviewer_consensus.txt"
    ],
    "workflow": "review_autofix"
  },
  "record_id": "mem_20260930031436_f7d1a7c051",
  "schema_version": "memory_record.v1",
  "scope": {
    "issue_number": null,
    "level": "run",
    "pr_number": 4943,
    "run_id": "36662314734"
  },
  "sensitive": false,
  "status": "candidate",
  "summary": "Reviewer consensus produced 0 consensus item(s); none flagged by multiple reviewers",
  "timestamps": {
    "created_at": "2026-09-30T03:14:36Z",
    "promoted_at": null,
    "superseded_at": null
  }
}
