{
  "category": "patterns",
  "confidence": 0.7,
  "details": "=== CONSENSUS FINDINGS ===\n(No findings reported.)\n=== END CONSENSUS FINDINGS ===\n\n=== CONSENSUS TASK GAPS ===\n(No task gaps reported.)\n=== END CONSENSUS TASK GAPS ===\n\n=== FINDINGS FROM google_gemini-3_1-flash-lite ===\n(No findings reported.)\n=== END FINDINGS FROM google_gemini-3_1-flash-lite ===\n\n=== FINDINGS FROM minimax_minimax-m3 ===\n(No findings reported.)\n=== END FINDINGS FROM minimax_minimax-m3 ===\n\n=== FINDINGS FROM openai_gpt-6-luna ===\n(No findings reported.)\n=== END FINDINGS FROM openai_gpt-6-luna ===\n\n=== FINDINGS FROM z-ai_glm-5_3-flash ===\n(No findings reported.)\n=== END FINDINGS FROM z-ai_glm-5_3-flash ===",
  "fingerprint": "68fb1016032ee6953bd2c3ff0015bfd9176d05c8e30e577fa04dd46a18c09e1e",
  "lineage": {
    "issue_number": null,
    "parent_ids": [],
    "pr_number": 8227,
    "run_id": "40445782792",
    "superseded_by": null,
    "supersedes": null
  },
  "provenance": {
    "actor": "shubhodeep1",
    "run_attempt": 1,
    "run_id": "40445782792",
    "source_refs": [
      "reviewer_consensus.txt"
    ],
    "workflow": "review_autofix"
  },
  "record_id": "mem_20261027041024_e9e6caf121",
  "schema_version": "memory_record.v1",
  "scope": {
    "issue_number": null,
    "level": "run",
    "pr_number": 8227,
    "run_id": "40445782792"
  },
  "sensitive": false,
  "status": "candidate",
  "summary": "Reviewer consensus produced 0 consensus item(s); none flagged by multiple reviewers",
  "timestamps": {
    "created_at": "2026-10-27T04:10:24Z",
    "promoted_at": null,
    "superseded_at": null
  }
}
