{
  "category": "patterns",
  "confidence": 0.7,
  "details": "=== CONSENSUS FINDINGS ===\n(No findings reported.)\n=== END CONSENSUS FINDINGS ===\n\n=== CONSENSUS TASK GAPS ===\n(No task gaps reported.)\n=== END CONSENSUS TASK GAPS ===\n\n=== FINDINGS FROM anthropic_claude-sonnet-5_5 ===\n(No findings reported.)\n=== END FINDINGS FROM anthropic_claude-sonnet-5_5 ===\n\n=== FINDINGS FROM minimax_minimax-m3 ===\n(No findings reported.)\n=== END FINDINGS FROM minimax_minimax-m3 ===\n\n=== FINDINGS FROM qwen_qwen3_7-plus ===\n(No findings reported.)\n=== END FINDINGS FROM qwen_qwen3_7-plus ===\n\n=== FINDINGS FROM z-ai_glm-5_3-flash ===\n(No findings reported.)\n=== END FINDINGS FROM z-ai_glm-5_3-flash ===",
  "fingerprint": "084744e271d169239a1503455a01c445eff447b2bf01372b6e75403ee31be54b",
  "lineage": {
    "issue_number": null,
    "parent_ids": [],
    "pr_number": 6896,
    "run_id": "38166165929",
    "superseded_by": null,
    "supersedes": null
  },
  "provenance": {
    "actor": "shubhodeep1",
    "run_attempt": 1,
    "run_id": "38166165929",
    "source_refs": [
      "reviewer_consensus.txt"
    ],
    "workflow": "review_autofix"
  },
  "record_id": "mem_20261011192024_a3e2f7db7a",
  "schema_version": "memory_record.v1",
  "scope": {
    "issue_number": null,
    "level": "run",
    "pr_number": 6896,
    "run_id": "38166165929"
  },
  "sensitive": false,
  "status": "candidate",
  "summary": "Reviewer consensus produced 0 consensus item(s); none flagged by multiple reviewers",
  "timestamps": {
    "created_at": "2026-10-11T19:20:24Z",
    "promoted_at": null,
    "superseded_at": null
  }
}
