{
  "category": "patterns",
  "confidence": 0.7,
  "details": "High confidence files (mentioned by >=2 reviewers):\n/tmp/codex-pr-24438100564-1-22533/previous_reviews/review_moonshotai_kimi-k2_5.txt:**File:**\nscripts/orchestrate_poll_process.sh\n\nLow confidence files (mentioned by 1 reviewer):\n.github/workflows/review_autofix.yml\n/tmp/codex-pr-24438100564-1-22533/previous_reviews/review_moonshotai_kimi-k2_5.txt:**File:**\n/tmp/codex-pr-24438100564-1-22533/previous_reviews/review_moonshotai_kimi-k2_5.txt:**File:**\nscripts/orchestrate_poll_process.sh",
  "fingerprint": "2fd3a745ac7386e7aec65042a52cd8d68af0114cc32bbf69d930d91790945225",
  "lineage": {
    "issue_number": null,
    "parent_ids": [],
    "pr_number": 1016,
    "run_id": "24438100564",
    "superseded_by": null,
    "supersedes": null
  },
  "provenance": {
    "actor": "shubhodeep1",
    "run_attempt": 1,
    "run_id": "24438100564",
    "source_refs": [
      "reviewer_consensus.txt"
    ],
    "workflow": "review_autofix"
  },
  "record_id": "mem_20260415054432_5c1a61cb7b",
  "schema_version": "memory_record.v1",
  "scope": {
    "issue_number": null,
    "level": "run",
    "pr_number": 1016,
    "run_id": "24438100564"
  },
  "sensitive": false,
  "status": "candidate",
  "summary": "Reviewer consensus flagged 2 high-confidence file(s)",
  "timestamps": {
    "created_at": "2026-04-15T05:44:32Z",
    "promoted_at": null,
    "superseded_at": null
  }
}
