{
  "category": "patterns",
  "confidence": 0.7,
  "details": "=== CONSENSUS FINDINGS ===\n- tests/test_claude_anthropic_relay.py:262-282 | severity=low | confidence=1\n  flagged_by: [deepseek_deepseek-v4-pro]\n  PROBLEM: The test verifies that the rejection timeout is reset after a drain read error.\n  WHY: The assertions correctly verify this behavior; the reviewer identified no defect.\n=== END CONSENSUS FINDINGS ===\n\n=== CONSENSUS TASK GAPS ===\n- requirement: \u201cThe live `pr_merge_status_guard.py`, `audit-plans.md`, `apply-url.md` and `implement-plan-ai.md` are copied from their templates.\u201d\n  expected_change_site: `.claude/commands/audit-plans.md`\n  confidence=[5]\n  flagged_by: [openai_gpt-6-luna]\n  EVIDENCE: The PR diff has no change to `.claude/commands/audit-plans.md`; the changelog explicitly says it was not changed. The PR-only parity preparation can mask this drift in its disposable checkout, while push CI checks committed parity and the new sync workflow creates a separate follow-up PR. The documented behavior therefore leaves CI red until that follow-up is merged.\n=== END CONSENSUS TASK GAPS ===\n\n=== FINDINGS FROM deepseek_deepseek-v4-pro ===\n- tests/test_claude_anthropic_relay.py:262-282 | severity=low | confidence=1\n  PROBLEM: The test asserts `connection.settimeout.assert_called_with(1)` inside the `reject` callback and also asserts `call_count == 2`.\n  WHY: These assertions are correct and verify the timeout reset after a drain error; no defect.\n=== END FINDINGS FROM deepseek_deepseek-v4-pro ===\n\n=== FINDINGS FROM google_gemini-3_8-flash ===\n(No findings reported.)\n=== END FINDINGS FROM google_gemini-3_8-flash ===\n\n=== FINDINGS FROM minimax_minimax-m3 ===\n(No findings reported.)\n=== END FINDINGS FROM minimax_minimax-m3 ===\n\n=== FINDINGS FROM openai_gpt-6-luna ===\n- Requirement: \u201cThe live `pr_merge_status_guard.py`, `audit-plans.md`, `apply-url.md` and `implement-plan-ai.md` are copied from their templates.\u201d\n  Expected change site: `.claude/commands/audit-plans.md`\n  Evidence of absence: The PR diff has no change to `.claude/commands/audit-plans.md`; the changelog explicitly says it was not changed. The PR-only parity preparation can mask this drift in its disposable checkout, while push CI checks committed parity and the new sync workflow creates a separate follow-up PR. The documented behavior therefore leaves CI red until that follow-up is merged.\n  SEVERITY: BLOCKER\n  ISSUE_CONFIDENCE: 5\n=== END FINDINGS FROM openai_gpt-6-luna ===\n\n=== FINDINGS FROM qwen_qwen3_7-plus ===\n(No findings reported.)\n=== END FINDINGS FROM qwen_qwen3_7-plus ===\n\n=== FINDINGS FROM z-ai_glm-5_2 ===\n(No findings reported.)\n=== END FINDINGS FROM z-ai_glm-5_2 ===",
  "fingerprint": "8d926fd396c243941f4cf57bb2b1dd0ebba71247a16e96e0221b0b80df9555ce",
  "lineage": {
    "issue_number": null,
    "parent_ids": [],
    "pr_number": 6288,
    "run_id": "37300839486",
    "superseded_by": null,
    "supersedes": null
  },
  "provenance": {
    "actor": "shubhodeep1",
    "run_attempt": 1,
    "run_id": "37300839486",
    "source_refs": [
      "reviewer_consensus.txt"
    ],
    "workflow": "review_autofix"
  },
  "record_id": "mem_20261005123544_656247b1b0",
  "schema_version": "memory_record.v1",
  "scope": {
    "issue_number": null,
    "level": "run",
    "pr_number": 6288,
    "run_id": "37300839486"
  },
  "sensitive": false,
  "status": "candidate",
  "summary": "Reviewer consensus produced 2 consensus item(s); none flagged by multiple reviewers",
  "timestamps": {
    "created_at": "2026-10-05T12:35:44Z",
    "promoted_at": null,
    "superseded_at": null
  }
}
