{
  "category": "decisions",
  "confidence": 0.85,
  "details": "The issue provided sufficient context for planning. Auto-posted /answer.",
  "fingerprint": "09a65d884fe10d6b8437b3b5b90cb9625654e0dfe2590c3e837bb05bb789710b",
  "lineage": {
    "issue_number": 4246,
    "parent_ids": [],
    "pr_number": null,
    "run_id": "35672661467",
    "superseded_by": null,
    "supersedes": null
  },
  "provenance": {
    "actor": "shubhodeep1",
    "run_attempt": 1,
    "run_id": "35672661467",
    "source_refs": [],
    "workflow": "clarify"
  },
  "record_id": "mem_20260922003952_49d6bc12f6",
  "schema_version": "memory_record.v1",
  "scope": {
    "issue_number": 4246,
    "level": "run",
    "pr_number": null,
    "run_id": "35672661467"
  },
  "sensitive": false,
  "status": "candidate",
  "summary": "Issue #4246 is clear - no clarification needed",
  "timestamps": {
    "created_at": "2026-09-22T00:39:52Z",
    "promoted_at": null,
    "superseded_at": null
  }
}
