{
  "category": "patterns",
  "confidence": 0.7,
  "details": "=== CONSENSUS FINDINGS ===\n(No findings reported.)\n=== END CONSENSUS FINDINGS ===\n\n=== CONSENSUS TASK GAPS ===\n- requirement: Resolve the conflicts and merge this PR so the bug fix on stable is also present on main.\n  expected_change_site: .github/workflows/memory_maintenance.yml, scripts/ai_memory_lib.py, tests/test_ai_memory_git_env_isolation.py, tests/test_memory_maintenance_contract_noop.py\n  confidence=[5]\n  flagged_by: [google_gemini-3_1-flash-lite]\n  EVIDENCE: The PR adds changelog.d/8287-memory-branch-single-branch-clone.md but fails to include any of the functional code changes required to resolve the merge conflicts mentioned in the PR description for .github/workflows/memory_maintenance.yml, scripts/ai_memory_lib.py, tests/test_ai_memory_git_env_isolation.py, and tests/test_memory_maintenance_contract_noop.py. The PR currently contains only the changelog entry and lacks the actual functional changes intended for the forward-merge. (Reviewer severity: BLOCKER)\n=== END CONSENSUS TASK GAPS ===\n\n=== FINDINGS FROM google_gemini-3_1-flash-lite ===\n- TASK_GAP: Requirement: Resolve the conflicts and merge this PR so the bug fix on stable is also present on main.\n  Expected change site: .github/workflows/memory_maintenance.yml, scripts/ai_memory_lib.py, tests/test_ai_memory_git_env_isolation.py, tests/test_memory_maintenance_contract_noop.py\n  Evidence of absence: The PR adds changelog.d/8287-memory-branch-single-branch-clone.md but fails to include any of the functional code changes required to resolve the merge conflicts mentioned in the PR description for .github/workflows/memory_maintenance.yml, scripts/ai_memory_lib.py, tests/test_ai_memory_git_env_isolation.py, and tests/test_memory_maintenance_contract_noop.py. The PR currently contains only the changelog entry and lacks the actual functional changes intended for the forward-merge.\n  SEVERITY: BLOCKER\n  ISSUE_CONFIDENCE: 5\n=== END FINDINGS FROM google_gemini-3_1-flash-lite ===",
  "fingerprint": "653572b2e3ef6d88756155c6b6c4c00faf05ea790eb6dce08c78b32027cdd09f",
  "lineage": {
    "issue_number": null,
    "parent_ids": [],
    "pr_number": 8328,
    "run_id": "40827282882",
    "superseded_by": null,
    "supersedes": null
  },
  "provenance": {
    "actor": "shubhodeep1",
    "run_attempt": 1,
    "run_id": "40827282882",
    "source_refs": [
      "reviewer_consensus.txt"
    ],
    "workflow": "review_autofix"
  },
  "record_id": "mem_20261029064048_e2c31dff18",
  "schema_version": "memory_record.v1",
  "scope": {
    "issue_number": null,
    "level": "run",
    "pr_number": 8328,
    "run_id": "40827282882"
  },
  "sensitive": false,
  "status": "candidate",
  "summary": "Reviewer consensus produced 1 consensus item(s); none flagged by multiple reviewers",
  "timestamps": {
    "created_at": "2026-10-29T06:40:48Z",
    "promoted_at": null,
    "superseded_at": null
  }
}
