{
  "category": "patterns",
  "confidence": 0.7,
  "details": "=== CONSENSUS FINDINGS ===\n(No findings reported.)\n=== END CONSENSUS FINDINGS ===\n\n=== CONSENSUS TASK GAPS ===\n(No task gaps reported.)\n=== END CONSENSUS TASK GAPS ===\n\n=== FINDINGS FROM deepseek_deepseek-v4-pro ===\n(No findings reported.)\n=== END FINDINGS FROM deepseek_deepseek-v4-pro ===\n\n=== FINDINGS FROM minimax_minimax-m3 ===\n(No findings reported.)\n=== END FINDINGS FROM minimax_minimax-m3 ===\n\n=== FINDINGS FROM openai_gpt-6-luna ===\n(No findings reported.)\n=== END FINDINGS FROM openai_gpt-6-luna ===\n\n=== FINDINGS FROM qwen_qwen3_7-plus ===\n(No findings reported.)\n=== END FINDINGS FROM qwen_qwen3_7-plus ===",
  "fingerprint": "80640d899eb856e8efa2992e965ad5bfc47f489c76a1286f35a1a925b14a9ae5",
  "lineage": {
    "issue_number": null,
    "parent_ids": [],
    "pr_number": 6432,
    "run_id": "37426332886",
    "superseded_by": null,
    "supersedes": null
  },
  "provenance": {
    "actor": "shubhodeep1",
    "run_attempt": 1,
    "run_id": "37426332886",
    "source_refs": [
      "reviewer_consensus.txt"
    ],
    "workflow": "review_autofix"
  },
  "record_id": "mem_20261006071523_bbd44c9627",
  "schema_version": "memory_record.v1",
  "scope": {
    "issue_number": null,
    "level": "run",
    "pr_number": 6432,
    "run_id": "37426332886"
  },
  "sensitive": false,
  "status": "candidate",
  "summary": "Reviewer consensus produced 0 consensus item(s); none flagged by multiple reviewers",
  "timestamps": {
    "created_at": "2026-10-06T07:15:23Z",
    "promoted_at": null,
    "superseded_at": null
  }
}
