{
  "category": "patterns",
  "confidence": 0.7,
  "details": "=== CONSENSUS FINDINGS ===\n=== END CONSENSUS FINDINGS ===\n\n=== FINDINGS FROM deepseek_deepseek-v4-pro ===\n(No findings reported.)\n=== END FINDINGS FROM deepseek_deepseek-v4-pro ===\n\n=== FINDINGS FROM minimax_minimax-m2_5 ===\n(No findings reported.)\n=== END FINDINGS FROM minimax_minimax-m2_5 ===\n\n=== FINDINGS FROM moonshotai_kimi-k2_5 ===\n(No findings reported.)\n=== END FINDINGS FROM moonshotai_kimi-k2_5 ===\n\n=== FINDINGS FROM qwen_qwen3_6-plus ===\n(No findings reported.)\n=== END FINDINGS FROM qwen_qwen3_6-plus ===\n\n=== FINDINGS FROM x-ai_grok-4_1-fast ===\n(No findings reported.)\n=== END FINDINGS FROM x-ai_grok-4_1-fast ===\n\n=== FINDINGS FROM z-ai_glm-5 ===\n(No findings reported.)\n=== END FINDINGS FROM z-ai_glm-5 ===",
  "fingerprint": "b6cdf159753bbd3c02cf7c103b6b68b2718c6d4670374d76dfa94ce851a871d0",
  "lineage": {
    "issue_number": null,
    "parent_ids": [],
    "pr_number": 2381,
    "run_id": "25601946586",
    "superseded_by": null,
    "supersedes": null
  },
  "provenance": {
    "actor": "shubhodeep1",
    "run_attempt": 1,
    "run_id": "25601946586",
    "source_refs": [
      "reviewer_consensus.txt"
    ],
    "workflow": "review_autofix"
  },
  "record_id": "mem_20260509132635_29f5bdc918",
  "schema_version": "memory_record.v1",
  "scope": {
    "issue_number": null,
    "level": "run",
    "pr_number": 2381,
    "run_id": "25601946586"
  },
  "sensitive": false,
  "status": "candidate",
  "summary": "Reviewer consensus produced 0 finding(s); none flagged by multiple reviewers",
  "timestamps": {
    "created_at": "2026-05-09T13:26:35Z",
    "promoted_at": null,
    "superseded_at": null
  }
}
